N|RUC|PROVEEDOR|MODALIDAD|DEPARTAMENTO|PROVINCIA|DISTRITO|UBIGEO|DOMICILIO LEGAL|EMAIL|TELEFONO|ESTADOS CONTRATOS|FECHA ACTUALIZACION
101|20610637389|CONSORCIO DMK|PRODUCTOS|PIURA|PIURA|CASTILLA|200104|AVENIDA RAMON CASTILLA N° 240, en el distrito de CASTILLA, provincia de PIURA, departamento de PIURA|GRUPOAMEJO@GMAIL.COM|73660048|ACTIVO|8/02/2024
102|20611450282|CONSORCIO AZUL|PRODUCTOS|PIURA|PIURA|PIURA|200101|URBANIZACIÓN SAN JOSE MZA LL LOTE 04, en el distrito de VEINTISEIS DE OCTUBRE, provincia de PIURA, departamento de PIURA|NNASSAU273@GMAIL.COM|996667575|ACTIVO|8/02/2024
103|20611060051|CONSORCIO LAS LOMAS|PRODUCTOS|PIURA|AYABACA|PAIMAS|200207|TUNEL VI - CARRETERA FRENTE CANAL QUIROZ, en el distrito de PAIMAS, provincia de AYABACA, departamento de PIURA|DISTRIBUCIONESMHY@GMAIL.COM|973483330|ACTIVO|8/02/2024
104|20611450282|CONSORCIO CORAL|PRODUCTOS|PIURA|PIURA|VEINTISEIS DE OCTUBRE|200115|URBANIZACIÓN SAN JOSE MZA LL LOTE 04, en el distrito de VEINTISEIS DE OCTUBRE, provincia de PIURA, departamento de PIURA|NNASSAU273@GMAIL.COM|996667575|ACTIVO|8/02/2024
105|20530317901|REPRESENTACIONES VIRGEN DE LAS NIEVES S.A.C.|PRODUCTOS|PIURA|PIURA|VEINTISEIS DE OCTUBRE|200115|PIURA / PIURA / VEINTISEIS DE OCTUBRE - ASOCIACIÓN UBIC. RUR.PREDIO ASOCIACIÓN SANTA LUCIA Lote 10 Sector COSCOMBA|GERENCIA1.VDN@GMAIL.COM|73616773|ACTIVO|8/02/2024
106|20611508426|CONSORCIO ALMACENES Y ALIMENTOS DEL NORTE|PRODUCTOS|PIURA|PIURA|PIURA|200101|FUNDO VICTORIA MZA C LOTE 09, en el distrito de MAGDALENA DEL MAR, provincia de LIMA, departamento de LIMA|EDYPGROUPSAC@GMAIL.COM|73340229|ACTIVO|8/02/2024
107|20484279871|CONSORCIO PIURANO|PRODUCTOS|PIURA|AYABACA|PAIMAS|200207|TUNEL VI - CARRETERA FRENTE CANAL QUIROZ, en el distrito de PAIMAS, provincia de AYABACA, departamento de PIURA|DISTRIBUCIONESMHY@GMAIL.COM|973483330|ACTIVO|8/02/2024
108|20610499466|CONSORCIO OLSUR|PRODUCTOS|PUNO|PUNO|PUNO|210101|BARRIO PORTEÑO - AVENIDA EL SOL N° 652, en el distrito de PUNO, provincia de PUNO, departamento de PUNO|EFRAIN.OPERADORES@GMAIL.COM|910094440|ACTIVO|8/02/2024
109|20406499562|ALIMENTOS PROCESADOS COILA S.A.C.|PRODUCTOS|PUNO|SAN ROMÁN|JULIACA|211101|PUNO / SAN ROMAN / JULIACA - URBANIZACIÓN SANTA MARIA - JIRON HUASCAR N° 1060|ALIPROCSAC@HOTMAIL.COM|51336599|ACTIVO|8/02/2024
110|20406544291|CONSORCIO NUTRITEC|PRODUCTOS|PUNO|SAN ROMAN|JULIACA|211101|URBANIZACION MUNICIPAL TAPARACHI MZA B LOTE 17B, en el distrito de JULIACA, provincia de SAN ROMAN, departamento de PUNO|NUTRITEC.EIRL@GMAIL.COM|951517792|ACTIVO|8/02/2024
111|20448860818|GRUPO MARKETING ALIMENTARIA S.A.C.|PRODUCTOS|PUNO|PUNO|PUNO|210101|PUNO / PUNO / PUNO - URBANIZACIÓN RINCONADA SALCEDO Mza P Lote 16|GMARKETINGASAC@GMAIL.COM|952034007|ACTIVO|8/02/2024
112|20601617022|CORPORACION BEGANX S.A.C.|PRODUCTOS|PUNO|SAN ROMAN|JULIACA|211101|PUNO / SAN ROMAN / JULIACA - URBANIZACIÓN SANTA ANA - JIRON NESTOR S. MOLINA Mza K Lote 12|BEGANXSAC@GMAIL.COM|951347445|ACTIVO|8/02/2024
113|20608434829|CONSORCIO NOVA|PRODUCTOS|PUNO|SAN ROMAN|JULIACA|211101|AV. CIRCUNVALACION N° 1189 , en el distrito de JULIACA, provincia de SAN ROMAN, departamento de PUNO|"CORPORACIONNOVAFLY@GMAIL.COM"|982919296|ACTIVO|8/02/2024
114|20447969531|CORPORACION GRANIX E.I.R.L.|PRODUCTOS|PUNO|SAN ROMAN|JULIACA|211101|PUNO / SAN ROMAN / JULIACA - URBANIZACIÓN APIRAJ - AVENIDA POLIGONO INDUSTRIAL Mza B Lote 1|CORPORACIONGRANIX@GMAIL.COM|952222794|ACTIVO|8/02/2024
115|20603500530|CONSORCIO GRUPO CORPALINSA|PRODUCTOS|PUNO|SAN ROMAN|JULIACA|211101|CENTRO POBLADO JULIACA - URBANIZACIÓN MARIA LUISA - AVENIDA CIRCUNVALACION N° 1189 MZA G1 LOTE 3, en el distrito de JULIACA, provincia de SAN ROMAN, departamento de PUNO|CORPALINSASRL@GMAIL.COM|966907011|ACTIVO|8/02/2024
116|20603741944|CONSORCIO GRUPO RB|PRODUCTOS|PUNO|SAN ROMAN|JULIACA|211101|URB TAPARACHI LOTE I33C - JULIACA, en el distrito de JULIACA, provincia de SAN ROMAN, departamento de PUNO|COMPANIA.ALIMENTICIA.2024@GMAIL.COM|957997546|ACTIVO|8/02/2024
117|10449466158|CONSORCIO ALIMENTOS NUTRITIVOS MG|PRODUCTOS|LIMA|LIMA|SAN MARTÍN DE PORRES|150135|OTROS APV 3 DE OCTUBRE MZA B LOTE 2, en el distrito de SAN MARTIN DE PORRES, provincia de LIMA, departamento de LIMA|EMERSON.COBETEX@GMAIL.COM|935083185|ACTIVO|8/02/2024
118|10447574271|CONSORCIO GRUPO EDEN FOODS|PRODUCTOS|PUNO|SAN ROMAN|JULIACA|211101|URBANIZACIÓN JORGE CHAVEZ - PASAJE WIRACOCHA N° 153, en el distrito de JULIACA, provincia de SAN ROMAN, departamento de PUNO|GRUPOEDENFOOD@GMAIL.COM|985223320|ACTIVO|8/02/2024
119|20606871253|CONSORCIO ILLARY ANDINA|PRODUCTOS|PUNO|AZANGARO|AZANGARO|210201|JR. POEMAS HUMANOS MZA. I LOTE 3 URB. ANEXO CESAR VALLEJO, en el distrito de JULIACA, provincia de SAN ROMAN, departamento de PUNO|INDUSTRIAS.AGROLEDOS@GMAIL.COM|988 416 784|ACTIVO|8/02/2024
120|20610500499|CONSORCIO ALTO MAYO|PRODUCTOS|SAN MARTÍN|SAN MARTÍN|MOYOBAMBA|220101|CENTRO POBLADO MOYOBAMBA - URBANIZACIÓN SN - JIRON ALONSO DE ALVARADO N° 601, en el distrito de MOYOBAMBA, provincia de MOYOBAMBA, departamento de SAN MARTIN,|WINWA.EIRL.2023@GMAIL.COM|967689855|ACTIVO|8/02/2024
121|20494056934|CONSORCIO KUSKA|PRODUCTOS|SAN MARTÍN|TOCACHE|ALMENDRAS|#N/A|CENTRO POBLADO ALMENDRAS - OTROS (ESPECIFICAR) ALMENDRAS - CARRETERA SECTOR ALMENDRAS N° S/N SECTOR ALMENDRAS, en el distrito de TOCACHE, provincia de TOCACHE, departamento de SAN MARTIN|GMISKYSONKO@GMAIL.COM|999213653|ACTIVO|8/02/2024
122|20611483865|CONSORCIO SANTA LUCIA|PRODUCTOS|HUANUCO|HUANUCO|HUANUCO|100101| JIRON ABTAO N° 1808, en el distrito de HUANUCO, provincia de HUANUCO, departamento de HUANUCO,|INDUSTRIADEALIMENTOSCHINCHAO@GMAIL.COM|925874965|ACTIVO|8/02/2024
123|20610473165|CONSORCIO LA HEROICA|PRODUCTOS|TACNA|TACNA|ALTO DE LA ALIANZA|230102|CENTRO POBLADO ALTO DE LA ALIANZA - CALLE 27 DE AGOSTO N° 1138, en el distrito de ALTO DE LA ALIANZA, provincia de TACNA, departamento de TACNA|DISTRIBUCIONESFASUE@HOTMAIL.COM|958866316|ACTIVO|8/02/2024
124|20611594951|CONSORCIO VIRGEN DE FATIMA|PRODUCTOS|UCAYALI|CORONEL PORTILLO|YARINACOCHA|250105|CALLE BALTA N° 113, en el distrito de YARINACOCHA, provincia de CORONEL PORTILLO, departamento de UCAYALI,|GARDEL.MURRIETA@GMAIL.COM|976489470|ACTIVO|8/02/2024
125|20602119891|CONSORCIO AGUAYTIA|PRODUCTOS|UCAYALI|PADRE ABAD|PADRE ABAD|250301|"CENTRO POBLADO AGUAYTIA - CENTRO POBLADO VILLA AGUAYTIA - JIRON VARGAS GUERRA MZA M2 LOTE 11, en el distrito de PADRE ABAD, provincia de PADRE ABAD,departamento de UCAYALI"|PARCHIS557@HOTMAIL.COM|61481095|ACTIVO|8/02/2024
126|10000697945|CONSORCIO LUZ Y VIDA|PRODUCTOS|UCAYALI|CORONEL PORTILLO|YARINACOCHA|250105|AVENIDA AV. YARINACOCHA MZA 167A LOTE 06, en el distrito de YARINACOCHA, provincia de CORONEL PORTILLO, departamento de UCAYALI|DILMAKS01@GMAIL.COM|61639378|ACTIVO|8/02/2024
127|20609132257|CONSORCIO SHIRAMBARI|PRODUCTOS|HUANUCO|HUANUCO|AMARILIS|100102|JIRON CHINA N° 397, en el distrito de AMARILIS, provincia de HUANUCO, departamento de HUANUCO|COMPANIAJARED@HOTMAIL.COM|966682268|ACTIVO|8/02/2024
128|20606948949|CONSORCIO INAMBU|PRODUCTOS|HUANUCO|HUANUCO|AMARILIS|100102|CENTRO POBLADO PAUCARBAMBA - JIRON COLONIAL N° 514, en el distrito de AMARILIS, provincia de HUANUCO, departamento de HUANUCO|MRFORCE2021@HOTMAIL.COM|915013685|ACTIVO|8/02/2024
129|20352372910|CONSORCIO AMAZONAS|PRODUCTOS|UCAYALI|CORONEL PORTILLO|CALLERÍA|250101|JIRON GUILLERMO SISLEY N° 848 MZA 317 LOTE 15 - 16, en el distrito de CALLERIA, provincia de CORONEL PORTILLO, departamento de UCAYALI|AGROAMAZONAS03@GMAIL.COM|945772400|ACTIVO|8/02/2024
130|20610552880|CONSORCIO NAJEYA|PRODUCTOS|UCAYALI|CORONEL PORTILLO|CALLERIA|250101|" CENTRO POBLADO PUCALLPA - OTROS (ESPECIFICAR) CERCADO - JIRON LETICIA N° 280, en el distrito de CALLERIA, provincia de CORONEL PORTILLO, departamento de UCAYALI"|"CORPNAJEYA@GMAIL.COM"|932951777|ACTIVO|8/02/2024
131|20611657081|CONSORCIO DELIGRAN|PRODUCTOS|UCAYALI|CORONEL PORTILLO|CALLERIA|250101|ASOCIACIÓN JULIO CESAR TELLO ET 2 - CALLE MARISCAL ANDRES AVELINO CACERES N° 1563, en el distrito de CAJAMARCA, provincia de CAJAMARCA|GRANINDUSTRIAALIMENTOS@GMAIL.COM|95716496|ACTIVO|8/02/2024